{
  "ai_precheck": "source_note_bytes_and_input_identity_verified; not_human_approval",
  "checks": [
    "content_and_exceptions",
    "applicability_and_claimed_source",
    "structured_fields_and_call_overrides",
    "dependencies_and_uncompiled_scope"
  ],
  "human_decision": null,
  "id": "urn:uuid:80d603a5-9296-5213-b19e-9a9327a4058f",
  "reviewer": null,
  "schema": "m2.rule-review-record@0.1.0",
  "source_fidelity_gate": "pending_normative_raw_to_library_coverage",
  "status": "awaiting_review",
  "subject_digest": "sha256:faf243e541241270290d0e2e4e563578726840e097dc2079251a1de915105193",
  "subject_id": "urn:uuid:659b86c5-36d3-5c8f-a68e-73df71ed1294"
}
