{
  "ai_precheck": "source_note_bytes_and_input_identity_verified; not_human_approval",
  "checks": [
    "content_and_exceptions",
    "applicability_and_claimed_source",
    "structured_fields_and_call_overrides",
    "dependencies_and_uncompiled_scope"
  ],
  "human_decision": null,
  "id": "urn:uuid:600f6d10-16ae-5ca1-9d2e-888f67d32254",
  "reviewer": null,
  "schema": "m2.rule-review-record@0.1.0",
  "source_fidelity_gate": "pending_normative_raw_to_library_coverage",
  "status": "awaiting_review",
  "subject_digest": "sha256:0a96d9e87cd38409d667b7a99511f8259d303476fb1a099b2411da998388e6d9",
  "subject_id": "urn:uuid:54f1247d-83b4-5942-8249-db0365d3c804"
}
