{
  "ai_precheck": "source_note_bytes_and_input_identity_verified; not_human_approval",
  "checks": [
    "content_and_exceptions",
    "applicability_and_claimed_source",
    "structured_fields_and_call_overrides",
    "dependencies_and_uncompiled_scope"
  ],
  "human_decision": null,
  "id": "urn:uuid:a1a69c89-6220-5c3e-8996-d8f2ddb62597",
  "reviewer": null,
  "schema": "m2.rule-review-record@0.1.0",
  "source_fidelity_gate": "pending_normative_raw_to_library_coverage",
  "status": "awaiting_review",
  "subject_digest": "sha256:b2b2ab1f6e825f9cbfda81bd752c23f37743e24b9f3bcbed9a111dd4082c9c90",
  "subject_id": "urn:uuid:41d0162f-23e7-5172-9ffb-0ce92ff0ee4d"
}
