{
  "ai_precheck": "source_note_bytes_and_input_identity_verified; not_human_approval",
  "checks": [
    "content_and_exceptions",
    "applicability_and_claimed_source",
    "structured_fields_and_call_overrides",
    "dependencies_and_uncompiled_scope"
  ],
  "human_decision": null,
  "id": "urn:uuid:04ee517c-a304-584c-abf4-76bf3ca753c8",
  "reviewer": null,
  "schema": "m2.rule-review-record@0.1.0",
  "source_fidelity_gate": "pending_normative_raw_to_library_coverage",
  "status": "awaiting_review",
  "subject_digest": "sha256:31ce7b66586b01968e5afe72f6ec6d38832b2b44fba200084a3fbef011636948",
  "subject_id": "urn:uuid:9b807124-e59e-5ea1-8ad0-05dc5451847e"
}
