{
  "ai_precheck": "source_note_bytes_and_input_identity_verified; not_human_approval",
  "checks": [
    "content_and_exceptions",
    "applicability_and_claimed_source",
    "structured_fields_and_call_overrides",
    "dependencies_and_uncompiled_scope"
  ],
  "human_decision": null,
  "id": "urn:uuid:58dad9cd-dc03-50e4-a2bd-0980642a13b3",
  "reviewer": null,
  "schema": "m2.rule-review-record@0.1.0",
  "source_fidelity_gate": "pending_normative_raw_to_library_coverage",
  "status": "awaiting_review",
  "subject_digest": "sha256:01476c0dda7fa4a254552daf8ec874aa40e3329dd191eafa985ead521d99c83d",
  "subject_id": "urn:uuid:9809bb64-da00-54a8-9512-ca442fc5befb"
}
